{
  "irVersion": 1,
  "name": "Login with valid credentials",
  "description": "A registered user signs in and lands on the dashboard.",
  "tags": ["smoke", "auth"],
  "parameters": [
    { "name": "username", "type": "string", "required": true },
    { "name": "password", "type": "string", "required": true, "secret": true }
  ],
  "steps": [
    {
      "id": "s1",
      "sourceStepIds": ["ts-1"],
      "description": "Open the login page",
      "action": "navigate",
      "target": { "page": "LoginPage" }
    },
    {
      "id": "s2",
      "sourceStepIds": ["ts-2"],
      "action": "fill",
      "target": { "page": "LoginPage", "element": "usernameInput" },
      "value": { "kind": "param", "name": "username" }
    },
    {
      "id": "s3",
      "sourceStepIds": ["ts-3"],
      "action": "fill",
      "target": { "page": "LoginPage", "element": "passwordInput" },
      "value": { "kind": "secret", "name": "password" }
    },
    {
      "id": "s4",
      "sourceStepIds": ["ts-4"],
      "action": "click",
      "target": { "page": "LoginPage", "element": "submitButton" }
    },
    {
      "id": "s5",
      "sourceStepIds": ["ts-5"],
      "action": "assert",
      "target": { "page": "DashboardPage", "element": "heading" },
      "assertion": { "condition": "visible" }
    }
  ]
}
